{
  "symbol": "META",
  "exchange": "NASDAQ",
  "type": "gainer",
  "summary": "Based on the news summaries, the stock price of Meta Platforms Inc. (META) might be moving due to the following factors:\n\n1. **Partnership with Google**: Although Google has declined to work with OpenAI, Meta's partnership with Google's AI products could provide valuable insights and technology to enhance its own AI products.\n2. **Search technology**: Advancements in search technology, such as Microsoft's investment in OpenAI's generative-AI technology, could benefit Meta's search engine, Bing.\n3. **Competition in the AI market**: The Justice Department's proposed remedy for Google's monopolization of the search market could create opportunities for Meta to enter the market and compete with Google.\n4. **Investment in AI research**: OpenAI's focus on research and development in AI could attract investors to Meta, which has its own AI research initiatives.\n5. **Regulatory environment**: The Justice Department's antitrust trial against Google could lead to changes in the regulatory environment that benefit Meta.\n6. **Analyst expectations**: Despite reduced price targets, analysts still maintain a Buy and Overweight rating, suggesting they believe in the company's long-term growth potential and AI tailwinds.\n7. **Q1 2025 results**: Analysts anticipate solid Q1 2025 results, which could lead to a positive surprise and boost the stock price.\n8. **AI growth potential**: As an AI stock, Meta's growth potential is significant, and analysts believe it could 10X over the next 2 years.\n9. **Hedge fund ownership**: With 262 hedge funds holding Meta stock, there is significant institutional ownership and potential for buying pressure to drive the stock price up.\n10. **Macroeconomic factors**: While macroeconomic uncertainties may have impacted the stock price, analysts believe that the company's growth potential and AI tailwinds will ultimately prevail.\n\nThese factors suggest that Meta's stock price could move up as investors become more optimistic about the company's growth potential and AI tailwinds.",
  "processed_articles": [
    {
      "title": "ChatGPT Chief Calls Search Crucial for OpenAI in Google Trial",
      "url": "https://finance.yahoo.com/news/chatgpt-chief-calls-search-crucial-180344015.html?.tsrc=rss",
      "date": "Tue, 22 Apr 2025 18:03:44 +0000",
      "key_sentences": "Google provides some access to Meta Platforms Inc. for its AI products, Turley said, a partnership Meta Chief Executive Officer Mark Zuckerberg has spoken about publicly. Microsoft Corp. has poured more than $13 billion into a partnership with OpenAI, tapping the startup\u2019s generative-AI technology to enhance its Bing search service, Edge internet browser and, most notably, integrate an AI Copilot service into Windows. \u201cYou can\u2019t have a super assistant that doesn\u2019t know the current facts or makes things up.\u201d OpenAI\u2019s ChatGPT, launched to the public in November 2022, was initially viewed internally as a research project. The Justice Department\u2019s proposed remedy for Google\u2019s monopolization of the market would require Google to share its search index with rivals to help them improve their products after the search giant\u2019s years of monopolization. (Bloomberg) -- OpenAI\u2019s goals of building a \u201csuper assistant\u201d app and reaching general artificial intelligence won\u2019t succeed without search technology but Google has declined to work with the startup, the head of its ChatGPT product testified Tuesday in the Google antitrust trial. Most Read from Bloomberg Trump Gives New York \u2018One Last Chance\u2019 to End Congestion Fee DOGE Visits National Gallery of Art to Discuss Museum\u2019s Legal Status Trump Administration Takes Over New York Penn Station Revamp The Racial Wealth Gap Is Not Just About Money OpenAI\u2019s Nick Turley said the company never intended to simply create a chatbot like its popular ChatGPT, and instead wanted to deliver a \u201csuper assistant\u201d that can help users complete tasks. The company didn\u2019t expect the app would become one of the most viral software products of all time, ushering in a new wave of AI investment and consumer frenzy. Since launching ChatGPT, OpenAI has started bringing more assistant-like functionality into its products, such as the ability to search the web, write code, and do complex research, as well as a tool called \u201cOperator,\u201d that can do tasks such as book a restaurant reservation on a user\u2019s behalf. \u201cWe are not trying to recreate the type of experience you find on Google with 10 blue links and ads,\u201d he said. Turley was called by the Justice Department to testify as part of a three-week trial aimed at determining what changes Google must make to its business after a federal judge found last year that the company monopolized the search market.",
      "named_entities": {
        "ORG": [
          "Bloomberg",
          "Google",
          "Bloomberg Trump Gives",
          "Legal Status Trump Administration",
          "the Justice Department\u2019s",
          "Alphabet Inc.\u2019s",
          "the Justice Department",
          "Microsoft Corp.",
          "OpenAI",
          "Edge",
          "AI Copilot",
          "Microsoft",
          "Bing\u2019s",
          "Turley",
          "Meta Platforms Inc.",
          "Meta",
          "The Justice Department\u2019s",
          "Bloomberg Businessweek",
          "Trump\u2019s Tariff Obsession",
          "Bloomberg L.P."
        ],
        "PERSON": [
          "OpenAI",
          "Nick Turley",
          "Turley",
          "Amit Mehta",
          "Bing",
          "Mark Zuckerberg",
          "Gyms Might Never Be"
        ],
        "DATE": [
          "Tuesday",
          "November 2022",
          "three-week",
          "last year",
          "August",
          "early 2024",
          "the end of this year",
          "several more years",
          "every single day",
          "2025"
        ],
        "GPE": [
          "New York",
          "Washington",
          "AI",
          "OpenAI"
        ],
        "CARDINAL": [
          "One",
          "10",
          "1"
        ],
        "MONEY": [
          "more than $13 billion"
        ],
        "LOC": [
          "Windows"
        ],
        "PERCENT": [
          "80%"
        ]
      },
      "keywords": [
        "Google",
        "search",
        "Turley",
        "super assistant",
        "OpenAI",
        "Bloomberg",
        "Justice Department",
        "testified Tuesday",
        "York Penn",
        "Bloomberg Trump"
      ],
      "condensed_text": "Title: ChatGPT Chief Calls Search Crucial for OpenAI in Google Trial\n\nKey information: Google provides some access to Meta Platforms Inc. for its AI products, Turley said, a partnership Meta Chief Executive Officer Mark Zuckerberg has spoken about publicly. Microsoft Corp. has poured more than $13 billion into a partnership with OpenAI, tapping the startup\u2019s generative-AI technology to enhance its Bing search service, Edge internet browser and, most notably, integrate an AI Copilot service into Windows. \u201cYou can\u2019t have a super assistant that doesn\u2019t know the current facts or makes things up.\u201d OpenAI\u2019s ChatGPT, launched to the public in November 2022, was initially viewed internally as a research project. The Justice Department\u2019s proposed remedy for Google\u2019s monopolization of the market would require Google to share its search index with rivals to help them improve their products after the search giant\u2019s years of monopolization. (Bloomberg) -- OpenAI\u2019s goals of building a \u201csuper assistant\u201d app and reaching general artificial intelligence won\u2019t succeed without search technology but Google has declined to work with the startup, the head of its ChatGPT product testified Tuesday in the Google antitrust trial. Most Read from Bloomberg Trump Gives New York \u2018One Last Chance\u2019 to End Congestion Fee DOGE Visits National Gallery of Art to Discuss Museum\u2019s Legal Status Trump Administration Takes Over New York Penn Station Revamp The Racial Wealth Gap Is Not Just About Money OpenAI\u2019s Nick Turley said the company never intended to simply create a chatbot like its popular ChatGPT, and instead wanted to deliver a \u201csuper assistant\u201d that can help users complete tasks. The company didn\u2019t expect the app would become one of the most viral software products of all time, ushering in a new wave of AI investment and consumer frenzy. Since launching ChatGPT, OpenAI has started bringing more assistant-like functionality into its products, such as the ability to search the web, write code, and do complex research, as well as a tool called \u201cOperator,\u201d that can do tasks such as book a restaurant reservation on a user\u2019s behalf. \u201cWe are not trying to recreate the type of experience you find on Google with 10 blue links and ads,\u201d he said. Turley was called by the Justice Department to testify as part of a three-week trial aimed at determining what changes Google must make to its business after a federal judge found last year that the company monopolized the search market.\n\nNamed entities:\n- ORG: Bloomberg, Google, Bloomberg Trump Gives, Legal Status Trump Administration, the Justice Department\u2019s\n- PERSON: OpenAI, Nick Turley, Turley, Amit Mehta, Bing\n- DATE: Tuesday, November 2022, three-week, last year, August\n- GPE: New York, Washington, AI, OpenAI\n- MONEY: more than $13 billion\n- PERCENT: 80%\nKeywords: Google, search, Turley, super assistant, OpenAI, Bloomberg, Justice Department, testified Tuesday, York Penn, Bloomberg Trump\n",
      "summary": "The processed news information highlights the importance of search technology for OpenAI's goals of building a \"super assistant\" app and reaching general artificial intelligence. The article mentions that Google has declined to work with OpenAI, and the Justice Department's proposed remedy for Google's monopolization of the search market would require Google to share its search index with rivals to help them improve their products.\n\nKey factors that could influence the stock price of Meta Platforms Inc. (META) and relate to the processed news information are:\n\n1. **Partnership with Google**: Although Google has declined to work with OpenAI, the fact that Meta has some access to Google's AI products could be a positive factor for Meta's stock price. This partnership could provide Meta with valuable insights and technology to enhance its own AI products.\n2. **Search technology**: As OpenAI's goals rely heavily on search technology, any advancements or breakthroughs in this area could benefit Meta, which has its own search engine, Bing. Microsoft's investment of over $13 billion in OpenAI's generative-AI technology to enhance its Bing search service could also be a positive factor for Meta.\n3. **Competition in the AI market**: The Justice Department's proposed remedy for Google's monopolization of the search market could create opportunities for other companies, including Meta, to enter the market and compete with Google. This increased competition could drive innovation and growth in the AI market, benefiting Meta's stock price.\n4. **Investment in AI research**: The article mentions that OpenAI's ChatGPT was initially viewed internally as a research project. This focus on research and development in AI could attract investors to Meta, which has its own AI research initiatives.\n5. **Regulatory environment**: The Justice Department's antitrust trial against Google could lead to changes in the regulatory environment that benefit Meta. If the trial results in Google being forced to share its search index with rivals, it could create opportunities for Meta to enter the market and compete with Google.\n\nOverall, while the article does not directly mention Meta's stock price, the factors mentioned above could indirectly influence the stock price by highlighting the importance of search technology, competition in the AI market, and investment in AI research."
    },
    {
      "title": "Meta Platforms, Inc. (META): Among Stocks That Could 10X Over the Next 2 Years",
      "url": "https://finance.yahoo.com/news/meta-platforms-inc-meta-among-174200222.html?.tsrc=rss",
      "date": "Tue, 22 Apr 2025 17:42:00 +0000",
      "key_sentences": "Amid concerns about the firm\u2019s performance in the second quarter and beyond, potentially impacted by the tariffs, TD Cowen analysts reduced the price target on the stock to $725 from $785 while keeping a Buy rating. Simultaneously, Morgan Stanley analyst Brian Nowak lowered the price target to $615 from $660 while maintaining an Overweight rating on the stock, taking into account macroeconomic factors as well as tariff challenges impacting e-commerce and digital advertising sectors. If you are looking for an AI stock that is more promising than META but that trades at less than 5 times its earnings, check out our report about thischeapest AI stock. In this article, we are going to take a look at where Meta Platforms, Inc. (NASDAQ:META) stands against other stocks that could 10X over the next 2 years. However, the analysts anticipate solid Q1 2025 results, with total revenue near the upper end of management\u2019s guidance and advertising revenue expected to rise approximately 17% year-over-year (foreign exchange impacts excluded). Overall, METAranks 1ston our list of stocks that could 10X over the next 2 years. As we acknowledge the growth potential of META, our conviction lies in the belief that AI stocks hold great promise for delivering high returns and doing so within a shorter time frame. Number of Hedge Fund Holders:262 Meta Platforms, Inc. (NASDAQ:META) builds the future of human connection and the technology that makes it possible. Although analysts believe in the company\u2019s long-term growth potential and AI tailwinds, several price targets for the stock have been cut down considering the current macro uncertainties. Our quarterly newsletter\u2019s strategy selects 14 small-cap and large-cap stocks every quarter and has returned 373.4% since May 2014, beating its benchmark by 218 percentage points (see more details here).",
      "named_entities": {
        "DATE": [
          "the Next 2 Years",
          "the next 2 years",
          "nearly a year",
          "90-day",
          "one-day",
          "2008",
          "January 2001",
          "2024",
          "quarterly",
          "every quarter",
          "May 2014",
          "the second quarter",
          "Q1 2025",
          "the beginning of 2025"
        ],
        "ORG": [
          "Meta Platforms, Inc.",
          "NASDAQ:META",
          "the World Economic Forum",
          "Nasdaq",
          "WhatsApp",
          "Morgan Stanley",
          "Overweight",
          "META",
          "AI"
        ],
        "CARDINAL": [
          "10X",
          "5,000",
          "almost 80",
          "40,608.45",
          "9",
          "14",
          "218",
          "two",
          "less than 5"
        ],
        "GPE": [
          "US",
          "China",
          "AI"
        ],
        "ORDINAL": [
          "first"
        ],
        "PERSON": [
          "Santiago Fern\u00e1ndez de Lis",
          "Messenger",
          "TD Cowen",
          "Brian Nowak"
        ],
        "PERCENT": [
          "125%",
          "104%",
          "9.52%",
          "almost 7.87%",
          "12.2%",
          "373.4%",
          "approximately 17%",
          "around 25%"
        ],
        "WORK_OF_ART": [
          "Facebook, Instagram"
        ],
        "MONEY": [
          "725",
          "785",
          "615",
          "660"
        ],
        "LOC": [
          "Buy"
        ],
        "NORP": [
          "North American"
        ],
        "PRODUCT": [
          "METAranks 1ston"
        ]
      },
      "keywords": [
        "Stocks",
        "stock",
        "tariffs",
        "Meta",
        "Meta Platforms",
        "Years",
        "hedge funds",
        "China",
        "markets",
        "global markets"
      ],
      "condensed_text": "Title: Meta Platforms, Inc. (META): Among Stocks That Could 10X Over the Next 2 Years\n\nKey information: Amid concerns about the firm\u2019s performance in the second quarter and beyond, potentially impacted by the tariffs, TD Cowen analysts reduced the price target on the stock to $725 from $785 while keeping a Buy rating. Simultaneously, Morgan Stanley analyst Brian Nowak lowered the price target to $615 from $660 while maintaining an Overweight rating on the stock, taking into account macroeconomic factors as well as tariff challenges impacting e-commerce and digital advertising sectors. If you are looking for an AI stock that is more promising than META but that trades at less than 5 times its earnings, check out our report about thischeapest AI stock. In this article, we are going to take a look at where Meta Platforms, Inc. (NASDAQ:META) stands against other stocks that could 10X over the next 2 years. However, the analysts anticipate solid Q1 2025 results, with total revenue near the upper end of management\u2019s guidance and advertising revenue expected to rise approximately 17% year-over-year (foreign exchange impacts excluded). Overall, METAranks 1ston our list of stocks that could 10X over the next 2 years. As we acknowledge the growth potential of META, our conviction lies in the belief that AI stocks hold great promise for delivering high returns and doing so within a shorter time frame. Number of Hedge Fund Holders:262 Meta Platforms, Inc. (NASDAQ:META) builds the future of human connection and the technology that makes it possible. Although analysts believe in the company\u2019s long-term growth potential and AI tailwinds, several price targets for the stock have been cut down considering the current macro uncertainties. Our quarterly newsletter\u2019s strategy selects 14 small-cap and large-cap stocks every quarter and has returned 373.4% since May 2014, beating its benchmark by 218 percentage points (see more details here).\n\nNamed entities:\n- DATE: the Next 2 Years, the next 2 years, nearly a year, 90-day, one-day\n- ORG: Meta Platforms, Inc., NASDAQ:META, the World Economic Forum, Nasdaq, WhatsApp\n- GPE: US, China, AI\n- PERSON: Santiago Fern\u00e1ndez de Lis, Messenger, TD Cowen, Brian Nowak\n- PERCENT: 125%, 104%, 9.52%, almost 7.87%, 12.2%\n- MONEY: 725, 785, 615, 660\nKeywords: Stocks, stock, tariffs, Meta, Meta Platforms, Years, hedge funds, China, markets, global markets\n",
      "summary": "Based on the processed news information, here are the key factors that could influence the stock price of Meta Platforms, Inc. (META) and potentially contribute to its upward movement:\n\n1. **Analyst expectations**: Despite reduced price targets from TD Cowen and Morgan Stanley, analysts still maintain a Buy and Overweight rating, respectively. This suggests that they believe in the company's long-term growth potential and AI tailwinds, which could drive the stock price up.\n2. **Q1 2025 results**: Analysts anticipate solid Q1 2025 results, with total revenue near the upper end of management's guidance and advertising revenue expected to rise approximately 17% year-over-year. This could lead to a positive surprise and boost the stock price.\n3. **AI growth potential**: As an AI stock, Meta's growth potential is significant, and analysts believe it could 10X over the next 2 years. This could attract investors seeking high-growth opportunities, driving the stock price up.\n4. **Hedge fund ownership**: With 262 hedge funds holding Meta stock, there is significant institutional ownership and potential for buying pressure to drive the stock price up.\n5. **Macroeconomic factors**: While macroeconomic uncertainties, such as tariffs, may have impacted the stock price, analysts believe that the company's growth potential and AI tailwinds will ultimately prevail.\n6. **Reduced price targets**: Although price targets have been cut, the reduced targets may be seen as a buying opportunity by investors, leading to a potential increase in the stock price.\n\nIn summary, the key factors that could influence the stock price of Meta Platforms, Inc. (META) and potentially contribute to its upward movement are:\n\n* Analyst expectations and ratings\n* Q1 2025 results and revenue growth\n* AI growth potential\n* Hedge fund ownership and buying pressure\n* Macroeconomic factors and reduced price targets\n\nThese factors suggest that Meta's stock price could move up as investors become more optimistic about the company's growth potential and AI tailwinds."
    },
    {
      "title": "Instagram\u2019s Systrom Says Zuckerberg Saw App\u2019s Growth as \u2018Threat\u2019",
      "url": "https://finance.yahoo.com/news/instagram-co-founder-claims-app-163459481.html?.tsrc=rss",
      "date": "Tue, 22 Apr 2025 17:10:33 +0000",
      "key_sentences": "\u201cWhen we acquired Instagram, it had about 2% of the users it has today, just 13 employees, no revenue, and virtually no infrastructure of its own,\u201d Meta\u2019s General Counsel Jennifer Newstead wrote in a blog post earlier this month before the trial started. \u201cMany of the features that are now central to the Instagram community \u2013 direct messaging, live video streaming, shopping, and stories \u2013 were built on Meta\u2019s core technology infrastructure after the acquisition.\u201d Roelof Botha, an early Instagram investor from Sequoia Capital, suggested during a video deposition that was played Monday in court that Instagram benefited from Meta\u2019s data centers and other technical infrastructure. (Bloomberg) -- Instagram co-founder Kevin Systrom testified that his fledgling photo-sharing app could have succeeded without being acquired by Meta Platforms Inc., and that eventually Chief Executive Officer Mark Zuckerberg treated Instagram\u2019s growth as a \u201cthreat\u201d and starved it of resources. Systrom said that he believed Instagram was capable of launching several important features, including support for videos and private messages, even if the company hadn\u2019t been acquired by Meta, then called Facebook Inc. FTC lawyers also showed emails from Systrom where he was frustrated about Meta\u2019s investment in Instagram. \u201cIt was in stark contrast to the effort I was putting in.\u201d Lawyers for the FTC are seeking to prove that by purchasing Instagram in 2012, and WhatsApp in 2014, Meta created an illegal social networking monopoly, and the agency wants US District Judge James Boasberg to undo those deals. Meta, meanwhile, has argued that Instagram became a massive success thanks in large part to the support it provided the photo app following the acquisition. In testimony Tuesday during Meta\u2019s antitrust trial in Washington, Systrom recounted how quickly Instagram was growing before Zuckerberg\u2019s offer. Following the Cambridge Analytica privacy scandal, Systrom says Instagram got no new headcount despite a broad effort to shore up Meta\u2019s data practices. Lawyers for the FTC have sought to establish that Instagram was an up-and-coming rival to Meta that would have been a formidable competitor had it stayed independent.",
      "named_entities": {
        "ORG": [
          "Bloomberg",
          "Meta Platforms Inc.",
          "Instagram",
          "Bloomberg Trump Gives",
          "Legal Status Trump Administration",
          "Meta",
          "Zuckerberg",
          "US Federal Trade Commission",
          "FTC",
          "Facebook Inc.",
          "Amazon Web Services",
          "WhatsApp",
          "Meta\u2019s General Counsel",
          "Sequoia Capital",
          "Meta\u2019s",
          "Facebook\u2019s",
          "Bloomberg Businessweek",
          "Trump\u2019s Tariff Obsession",
          "Bloomberg L.P."
        ],
        "PERSON": [
          "Kevin Systrom",
          "Mark Zuckerberg",
          "Systrom",
          "Instagram",
          "Bob Zuver",
          "Zuckerberg",
          "Mike Schroepfer",
          "James Boasberg",
          "Jennifer Newstead",
          "Roelof Botha",
          "Sequoia",
          "Twitter",
          "Gyms Might Never Be"
        ],
        "GPE": [
          "New York",
          "US",
          "Washington",
          "Instagram"
        ],
        "CARDINAL": [
          "One",
          "13-fold",
          "zero",
          "300",
          "dozens",
          "just 13"
        ],
        "DATE": [
          "2012",
          "Tuesday",
          "2011",
          "the year",
          "2017",
          "2014",
          "2018",
          "first week",
          "today",
          "earlier this month",
          "Monday",
          "2025"
        ],
        "WORK_OF_ART": [
          "Instagram"
        ],
        "NORP": [
          "Instagram"
        ],
        "MONEY": [
          "$1 billion"
        ],
        "PERCENT": [
          "about 2%"
        ]
      },
      "keywords": [
        "Platforms Inc.",
        "Instagram",
        "Systrom",
        "Kevin Systrom",
        "Meta Platforms",
        "Meta",
        "Mark Zuckerberg",
        "co-founder Kevin",
        "Officer Mark",
        "Facebook"
      ],
      "condensed_text": "Title: Instagram\u2019s Systrom Says Zuckerberg Saw App\u2019s Growth as \u2018Threat\u2019\n\nKey information: \u201cWhen we acquired Instagram, it had about 2% of the users it has today, just 13 employees, no revenue, and virtually no infrastructure of its own,\u201d Meta\u2019s General Counsel Jennifer Newstead wrote in a blog post earlier this month before the trial started. \u201cMany of the features that are now central to the Instagram community \u2013 direct messaging, live video streaming, shopping, and stories \u2013 were built on Meta\u2019s core technology infrastructure after the acquisition.\u201d Roelof Botha, an early Instagram investor from Sequoia Capital, suggested during a video deposition that was played Monday in court that Instagram benefited from Meta\u2019s data centers and other technical infrastructure. (Bloomberg) -- Instagram co-founder Kevin Systrom testified that his fledgling photo-sharing app could have succeeded without being acquired by Meta Platforms Inc., and that eventually Chief Executive Officer Mark Zuckerberg treated Instagram\u2019s growth as a \u201cthreat\u201d and starved it of resources. Systrom said that he believed Instagram was capable of launching several important features, including support for videos and private messages, even if the company hadn\u2019t been acquired by Meta, then called Facebook Inc. FTC lawyers also showed emails from Systrom where he was frustrated about Meta\u2019s investment in Instagram. \u201cIt was in stark contrast to the effort I was putting in.\u201d Lawyers for the FTC are seeking to prove that by purchasing Instagram in 2012, and WhatsApp in 2014, Meta created an illegal social networking monopoly, and the agency wants US District Judge James Boasberg to undo those deals. Meta, meanwhile, has argued that Instagram became a massive success thanks in large part to the support it provided the photo app following the acquisition. In testimony Tuesday during Meta\u2019s antitrust trial in Washington, Systrom recounted how quickly Instagram was growing before Zuckerberg\u2019s offer. Following the Cambridge Analytica privacy scandal, Systrom says Instagram got no new headcount despite a broad effort to shore up Meta\u2019s data practices. Lawyers for the FTC have sought to establish that Instagram was an up-and-coming rival to Meta that would have been a formidable competitor had it stayed independent.\n\nNamed entities:\n- ORG: Bloomberg, Meta Platforms Inc., Instagram, Bloomberg Trump Gives, Legal Status Trump Administration\n- PERSON: Kevin Systrom, Mark Zuckerberg, Systrom, Instagram, Bob Zuver\n- GPE: New York, US, Washington, Instagram\n- DATE: 2012, Tuesday, 2011, the year, 2017\n- MONEY: $1 billion\n- PERCENT: about 2%\nKeywords: Platforms Inc., Instagram, Systrom, Kevin Systrom, Meta Platforms, Meta, Mark Zuckerberg, co-founder Kevin, Officer Mark, Facebook\n",
      "summary": "The processed news information suggests that Instagram's co-founder Kevin Systrom testified in Meta's antitrust trial that the company's growth was not dependent on being acquired by Meta, and that Mark Zuckerberg treated Instagram's growth as a \"threat\" and starved it of resources. This could have several implications for the stock price:\n\n1. **Perception of Meta's acquisition strategy**: If the court finds that Meta's acquisition of Instagram was an attempt to eliminate a competitor, it could damage the company's reputation and lead to a decline in stock price. On the other hand, if the court rules in Meta's favor, it could reinforce the company's strategy and boost investor confidence.\n2. **Competition and market share**: If Instagram had continued to grow independently, it could have become a significant competitor to Meta, potentially eroding the company's market share. This could lead to a decrease in Meta's stock price if investors become concerned about the company's ability to maintain its market position.\n3. **Resource allocation**: Systrom's testimony suggests that Meta may have underinvested in Instagram, which could have hindered the company's growth. If the court finds that Meta's resource allocation was inadequate, it could lead to a decline in stock price as investors question the company's ability to allocate resources effectively.\n4. **Regulatory scrutiny**: The antitrust trial could lead to increased regulatory scrutiny of Meta's business practices, which could result in fines, penalties, or even the breakup of the company. This could lead to a decline in stock price as investors become concerned about the potential consequences.\n5. **CEO Mark Zuckerberg's reputation**: Systrom's testimony could damage Zuckerberg's reputation, which could have a negative impact on Meta's stock price. Investors may become concerned about the company's leadership and future direction.\n\nKey factors that could influence Meta's stock price in the short term include:\n\n1. The outcome of the antitrust trial\n2. The company's ability to demonstrate the benefits of its acquisition strategy\n3. The level of regulatory scrutiny and potential penalties\n4. The company's ability to allocate resources effectively\n5. The impact of Systrom's testimony on Mark Zuckerberg's reputation\n\nIn the long term, the stock price could be influenced by factors such as:\n\n1. The company's ability to innovate and stay ahead of competitors\n2. The growth of its core platforms, including Facebook and Instagram\n3. The company's ability to expand into new markets and industries\n4. The level of competition in the social media and technology sectors\n5. The company's ability to adapt to changing consumer behavior and technological trends."
    }
  ],
  "daily_change_percentage": 3.2228768619572947,
  "date_generated": "2025-04-22T21:37:19.984022+00:00"
}