{
  "symbol": "MSFT",
  "exchange": "NASDAQ",
  "type": "loser",
  "summary": "Based on the news summaries, the stock of Microsoft (MSFT) might be moving due to the following factors:\n\n1. **Market sell-off**: A broader market trend could lead to a decline in MSFT stock price.\n2. **Volatility**: Elevated market uncertainty could cause investors to reassess their positions and potentially sell MSFT stock.\n3. **Bearish consumer and CEO sentiment**: If consumer and CEO sentiment remains bearish, it could lead to decreased investor confidence and a decline in MSFT stock price.\n4. **Lack of extreme moves**: The VIX staying in the 20s means that extreme market moves are less likely, which could lead to a flat or declining stock price.\n5. **Competition and industry trends**: Intense competition from other technology companies could lead to a decline in MSFT stock price if investors become more cautious.\n6. **Economic uncertainty and potential recession**: If the data doesn't catch up to the bearish sentiment, it could lead to a recession, negatively impacting MSFT's stock price.\n\nThese factors could contribute to a decline in MSFT stock price, although it's essential to consider other market and company-specific factors before making any investment decisions.",
  "processed_articles": [
    {
      "title": "How to trade the Magnificent 7 amid the market sell-off",
      "url": "https://finance.yahoo.com/video/trade-magnificent-7-amid-market-120021370.html?.tsrc=rss",
      "date": "Tue, 22 Apr 2025 12:00:21 +0000",
      "key_sentences": "As US stocks (^DJI,^GSPC,^IXIC) sell off, Solidarity Capital CEO Jeff McClean sits down withJosh Liptonto check in on the \"Magnificent Seven,\" made up of Nvidia (NVDA), Alphabet (GOOG,GOOGL), Tesla (TSLA), Microsoft (MSFT), Amazon (AMZN), Meta (META), and Apple (AAPL). Unlock stock picks and a broker-level newsfeed that powers Wall Street. To watch more expert insights and analysis on the latest market action, check out more Asking for a Trendhere. It's been happening over the past couple weeks of a deterioration. The speed is Yeah, the speed from February 19th to April 7th was dramatic. But I think now the extreme volatility, knock on wood is hopefully behind us and the volatility will stay elevated. The VIX, I think it's going to stay in the 20s for the long foreseeable future here. But I don't see us having extreme 5%, 7%, 9% days, things like that. Either consumer and CEO sentiment has to veer from very bearish, like it is right now, to something more neutral or the data is going to catch up to the sentiment and we're going to be led into a recession. If consumers are scared and like they are right now, some of the survey data says it's like 2008, 2009 out there in their minds.",
      "named_entities": {
        "GPE": [
          "US",
          "Nvidia",
          "Alphabet"
        ],
        "ORG": [
          "Solidarity Capital",
          "NVDA",
          "GOOG",
          "Microsoft",
          "MSFT",
          "Amazon",
          "Meta",
          "META",
          "Apple",
          "VIX",
          "Trump",
          "Truth Social",
          "MAG",
          "Google",
          "YouTube",
          "AdEx"
        ],
        "PERSON": [
          "Jeff McClean",
          "Liptonto",
          "Alphabet",
          "Tesla",
          "Jeff",
          "Uncle Sam",
          "Trump",
          "Alphabet 2",
          "Instagram"
        ],
        "DATE": [
          "a day like today",
          "the weekend",
          "significantly year",
          "the past couple weeks",
          "February 19th to April 7th",
          "the 20s",
          "like 2008",
          "2009",
          "another couple weeks",
          "the next week"
        ],
        "PERCENT": [
          "5%",
          "7%",
          "9%",
          "about 20%",
          "30%"
        ],
        "CARDINAL": [
          "one",
          "two",
          "7"
        ],
        "ORDINAL": [
          "third"
        ],
        "MONEY": [
          "trillion dollar",
          "a couple billion dollar",
          "couple billion"
        ],
        "QUANTITY": [
          "a ton"
        ]
      },
      "keywords": [
        "Wall Street",
        "powers Wall",
        "Yeah",
        "Solidarity Capital",
        "broker-level newsfeed",
        "Meta",
        "Jeff",
        "Unlock stock",
        "stock picks",
        "Street"
      ],
      "condensed_text": "Title: How to trade the Magnificent 7 amid the market sell-off\n\nKey information: As US stocks (^DJI,^GSPC,^IXIC) sell off, Solidarity Capital CEO Jeff McClean sits down withJosh Liptonto check in on the \"Magnificent Seven,\" made up of Nvidia (NVDA), Alphabet (GOOG,GOOGL), Tesla (TSLA), Microsoft (MSFT), Amazon (AMZN), Meta (META), and Apple (AAPL). Unlock stock picks and a broker-level newsfeed that powers Wall Street. To watch more expert insights and analysis on the latest market action, check out more Asking for a Trendhere. It's been happening over the past couple weeks of a deterioration. The speed is Yeah, the speed from February 19th to April 7th was dramatic. But I think now the extreme volatility, knock on wood is hopefully behind us and the volatility will stay elevated. The VIX, I think it's going to stay in the 20s for the long foreseeable future here. But I don't see us having extreme 5%, 7%, 9% days, things like that. Either consumer and CEO sentiment has to veer from very bearish, like it is right now, to something more neutral or the data is going to catch up to the sentiment and we're going to be led into a recession. If consumers are scared and like they are right now, some of the survey data says it's like 2008, 2009 out there in their minds.\n\nNamed entities:\n- GPE: US, Nvidia, Alphabet\n- ORG: Solidarity Capital, NVDA, GOOG, Microsoft, MSFT\n- PERSON: Jeff McClean, Liptonto, Alphabet, Tesla, Jeff\n- DATE: a day like today, the weekend, significantly year, the past couple weeks, February 19th to April 7th\n- PERCENT: 5%, 7%, 9%, about 20%, 30%\n- MONEY: trillion dollar, a couple billion dollar, couple billion\nKeywords: Wall Street, powers Wall, Yeah, Solidarity Capital, broker-level newsfeed, Meta, Jeff, Unlock stock, stock picks, Street\n",
      "summary": "Based on the processed news information, here are some key factors that could influence MSFT (Microsoft) stock price and potentially contribute to its downward movement:\n\n1. **Market sell-off**: The article mentions a market sell-off, which could lead to a decline in MSFT stock price. As a large-cap technology company, MSFT is often affected by broader market trends.\n2. **Volatility**: The CEO of Solidarity Capital, Jeff McClean, expects volatility to stay elevated, but not at extreme levels. This could lead to increased market uncertainty, causing investors to reassess their positions and potentially sell MSFT stock.\n3. **Consumer and CEO sentiment**: McClean notes that consumer and CEO sentiment is currently very bearish. If this sentiment persists, it could lead to a decrease in investor confidence, causing MSFT stock to decline.\n4. **Data catching up to sentiment**: McClean suggests that if the data doesn't catch up to the bearish sentiment, it could lead to a recession. This could have a negative impact on MSFT's stock price, as the company's performance is closely tied to the overall economy.\n5. **Lack of extreme moves**: McClean expects the VIX to stay in the 20s, which means that extreme market moves (e.g., 5%, 7%, 9% days) are less likely. While this might provide some stability, it also means that MSFT stock may not experience significant upward momentum, potentially leading to a flat or declining stock price.\n6. **Competition and industry trends**: As a technology company, MSFT faces intense competition from other industry players. If the market is experiencing a downturn, investors may become more cautious and reevaluate their positions, potentially leading to a decline in MSFT stock.\n\nIn summary, the processed news information suggests that MSFT stock may be influenced by the following factors:\n\n* Market sell-off and volatility\n* Bearish consumer and CEO sentiment\n* Lack of extreme market moves\n* Competition and industry trends\n* Economic uncertainty and potential recession\n\nThese factors could contribute to a decline in MSFT stock price, although it's essential to consider other market and company-specific factors before making any investment decisions."
    },
    {
      "title": "Bill Gates' Harvard Professor Thought, 'What A Waste' When He Left Academia, But That 'Small Company' He Founded Changed The World",
      "url": "https://finance.yahoo.com/news/bill-gates-harvard-professor-thought-013115282.html?.tsrc=rss",
      "date": "Tue, 22 Apr 2025 01:31:15 +0000",
      "key_sentences": "Don’t Miss: Inspired by Uber and Airbnb – Deloitte's fastest-growing software company is transforming 7 billion smartphones into income-generating assets –with $1,000 you can invest at just $0.26/share! These five entrepreneurs are worth $223 billion –they all believe in one platform that offers a 7-9% target yield with monthly dividends Photo Courtesy: Alexandros Michailidis On Shutterstock.com Send To MSN:  Send to MSN UNLOCKED: 5 NEW TRADES EVERY WEEK.Click now to get top trade ideas daily, plus unlimited access to cutting-edge tools and strategies to gain an edge in the markets. Before he becameone of the wealthiest peopleon the planet withMicrosoft Inc.(NASDAQ:MSFT),Bill Gateswas just another Harvard undergrad, albeit one whose intelligence made a long-lasting impression on his professors. Read Next: BlackRock is calling 2025 the year of alternative assets.One firm from NYC has quietly built a group of 60,000+ investors who have all joined in on an alt asset class previously exclusive to billionaires like Bezos and Gates. Unlock stock picks and a broker-level newsfeed that powers Wall Street. What Happened: In the 1970s, Gates co-authored a paper on a mathematical problem called \"pancake sorting\" with Papadimitriou. His unique solution slashed the number of necessary operations drastically and held the world record for decades. But just two years later, when Papadimitriou called Gates to share the news that their paper had been accepted for publication in a prestigious journal, Gates had already changed course, relocating to New Mexico to concentrate on hissoftware company. While Papadimitriou saw Gates' re-orientation as a loss in the early days, history proved otherwise. Get the latest stock analysis from Benzinga?",
      "named_entities": {
        "ORG": [
          "Harvard",
          "Gates",
          "Deloitte",
          "Microsoft",
          "BlackRock",
          "NYC",
          "Photo Courtesy",
          "Shutterstock.com Send To MSN",
          "MSN UNLOCKED",
          "onBenzinga.com",
          "Benzinga.com"
        ],
        "CARDINAL": [
          "One",
          "7 billion",
          "one",
          "60,000",
          "five",
          "5",
          "2025"
        ],
        "PERSON": [
          "Christos Papadimitriou",
          "Papadimitriou",
          "Bill Gates",
          "Bezos",
          "Alexandros Michailidis",
          "Benzinga",
          "Thought",
          "Left Academia"
        ],
        "DATE": [
          "the 1970s",
          "decades",
          "just two years later",
          "several years later",
          "Two years later",
          "the early days",
          "2025",
          "the year",
          "monthly",
          "daily"
        ],
        "MONEY": [
          "1,000",
          "just $0.26",
          "$223 billion"
        ],
        "NORP": [
          "Americans"
        ],
        "GPE": [
          "New Mexico",
          "Albuquerque"
        ],
        "PERCENT": [
          "7-9%"
        ]
      },
      "keywords": [
        "Wall Street",
        "powers Wall",
        "broker-level newsfeed",
        "Gates",
        "Papadimitriou",
        "Street",
        "Wall",
        "Bill Gateswas",
        "withMicrosoft Inc.",
        "company"
      ],
      "condensed_text": "Title: Bill Gates' Harvard Professor Thought, 'What A Waste' When He Left Academia, But That 'Small Company' He Founded Changed The World\n\nKey information: Don’t Miss: Inspired by Uber and Airbnb – Deloitte's fastest-growing software company is transforming 7 billion smartphones into income-generating assets –with $1,000 you can invest at just $0.26/share! These five entrepreneurs are worth $223 billion –they all believe in one platform that offers a 7-9% target yield with monthly dividends Photo Courtesy: Alexandros Michailidis On Shutterstock.com Send To MSN:  Send to MSN UNLOCKED: 5 NEW TRADES EVERY WEEK.Click now to get top trade ideas daily, plus unlimited access to cutting-edge tools and strategies to gain an edge in the markets. Before he becameone of the wealthiest peopleon the planet withMicrosoft Inc.(NASDAQ:MSFT),Bill Gateswas just another Harvard undergrad, albeit one whose intelligence made a long-lasting impression on his professors. Read Next: BlackRock is calling 2025 the year of alternative assets.One firm from NYC has quietly built a group of 60,000+ investors who have all joined in on an alt asset class previously exclusive to billionaires like Bezos and Gates. Unlock stock picks and a broker-level newsfeed that powers Wall Street. What Happened: In the 1970s, Gates co-authored a paper on a mathematical problem called \"pancake sorting\" with Papadimitriou. His unique solution slashed the number of necessary operations drastically and held the world record for decades. But just two years later, when Papadimitriou called Gates to share the news that their paper had been accepted for publication in a prestigious journal, Gates had already changed course, relocating to New Mexico to concentrate on hissoftware company. While Papadimitriou saw Gates' re-orientation as a loss in the early days, history proved otherwise. Get the latest stock analysis from Benzinga?\n\nNamed entities:\n- ORG: Harvard, Gates, Deloitte, Microsoft, BlackRock\n- PERSON: Christos Papadimitriou, Papadimitriou, Bill Gates, Bezos, Alexandros Michailidis\n- DATE: the 1970s, decades, just two years later, several years later, Two years later\n- MONEY: 1,000, just $0.26, $223 billion\n- GPE: New Mexico, Albuquerque\n- PERCENT: 7-9%\nKeywords: Wall Street, powers Wall, broker-level newsfeed, Gates, Papadimitriou, Street, Wall, Bill Gateswas, withMicrosoft Inc., company\n",
      "summary": "The processed news information does not directly mention MSFT stock moving down, but it does contain some key factors that could influence the stock price. Here are a few possible connections:\n\n1. **Bill Gates' legacy and Microsoft's performance**: The article highlights Bill Gates' early days at Harvard and his eventual departure to focus on his software company, which became Microsoft. This could lead to a connection between Gates' legacy and Microsoft's current performance. If investors perceive Microsoft's recent performance as underwhelming or unimpressive, it could negatively impact the stock price.\n2. **Competition and market trends**: The article mentions Deloitte's fastest-growing software company, which is transforming smartphones into income-generating assets. This could be seen as a threat to Microsoft's dominance in the software industry. If investors believe that this new company is gaining traction and could potentially disrupt Microsoft's business model, it could lead to a decline in MSFT stock price.\n3. **Interest in alternative assets**: The article mentions BlackRock's prediction that 2025 will be the year of alternative assets. This could lead to a shift in investor sentiment away from traditional stocks like MSFT and towards alternative assets. If investors become more interested in alternative assets, it could lead to a decline in MSFT stock price.\n4. **Market sentiment and Wall Street**: The article mentions Wall Street and the power of broker-level newsfeeds. Market sentiment can be influenced by news and rumors, and if investors become bearish on MSFT stock, it could lead to a decline in the stock price.\n\nIn conclusion, while the processed news information does not directly mention MSFT stock moving down, it contains several key factors that could influence the stock price. These factors include Bill Gates' legacy and Microsoft's performance, competition and market trends, interest in alternative assets, and market sentiment and Wall Street."
    },
    {
      "title": "Where Will Palantir Stock Be in 3 Years?",
      "url": "https://www.fool.com/investing/2025/04/21/where-will-palantir-stock-be-in-3-years/?source=eptyholnk0000202&utm_source=yahoo-host-full&utm_medium=feed&utm_campaign=article&referring_guid=125827e5-3280-4b27-82a1-bd322b8dabec&.tsrc=rss",
      "date": "Mon, 21 Apr 2025 22:45:00 +0000",
      "key_sentences": "Management only expects revenue to grow 31% year over year (to between $3.7 billion and $3.8 billion) in 2025, which isn't exciting for a stock trading for 79 times sales and 172 timesprojected future earnings. More recently, it was awarded a $480 billion deal to help build the army's Maven Smart System -- a data analytics contract thatAlphabet'sGoogle famously abandoned amid employee backlash in 2018. While the Trump administration initially claimed it wanted to reduce the Pentagon's budget, it has radically changed course, with Trump promising a record $1 trillion in defense spending for 2026, a 12% increase from current levels. Suzanne Frey, an executive at Alphabet, is a member of The Motley Fool’s board of directors.Will Ebiefunghas no position in any of the stocks mentioned. Become a Motley Fool member today toget instant access to our top analyst recommendations, in-depth research, investing resources,and more.Learn More Key Points With shares up 647% since 2022,Palantir Technologies(PLTR-3.10%)has performed spectacularly over the last three years, highlighting the potentially life-changing power of tech investing. Since its founding in 2003, Palantir has emerged as a leader in big data analytics, enabling organizations to uncover actionable insights, detect fraud, and optimize their operations by sifting through vast volumes of information. However, Palantir's most significant breakthrough may have come in April, when NATO (a military alliance of 32 countries in Europe and North America) finalized a deal to utilize the company's Maven Smart System to recommend and prioritize targets during combat operations. That said, a good business isn't always a good investment when valuation is taken into consideration. For context, theS&P 500index trades for just 20 times forward earnings, so to call Palantir priced for perfection seems like an understatement. The Motley Fool recommends the following options: long January 2026 $395 calls on Microsoft and short January 2026 $405 calls on Microsoft.",
      "named_entities": {
        "ORG": [
          "The Motley Fool's Premium Investing Services",
          "AI",
          "Trump",
          "Immigration and Customs Enforcement (ICE",
          "Maven Smart System",
          "Google",
          "Getty Images",
          "NATO",
          "Wedbush",
          "Pentagon",
          "the U.S. Army",
          "The Motley Fool’s",
          "The Motley Fool",
          "Microsoft",
          "Palantir Technologies"
        ],
        "DATE": [
          "today",
          "the last three years",
          "the next three years",
          "2003",
          "2018",
          "2024",
          "April",
          "2026",
          "year over year",
          "2025",
          "January 2026"
        ],
        "WORK_OF_ART": [
          "Learn More Key Points With"
        ],
        "PERCENT": [
          "647%",
          "12%",
          "31%"
        ],
        "CARDINAL": [
          "2022,Palantir",
          "one",
          "32",
          "79",
          "172",
          "500index",
          "just 20"
        ],
        "PERSON": [
          "Palantir",
          "Peter Thiel",
          "Trump",
          "Dan Ives",
          "Suzanne Frey",
          "Will Ebiefunghas"
        ],
        "GPE": [
          "OpenAI",
          "U.S.",
          "Ukraine",
          "Israel",
          "Palantir",
          "Alphabet",
          "Nvidia"
        ],
        "MONEY": [
          "$480 billion",
          "a record $1 trillion",
          "between $3.7 billion and $3.8 billion",
          "395",
          "405"
        ],
        "LOC": [
          "Europe",
          "North America"
        ],
        "NORP": [
          "American"
        ]
      },
      "keywords": [
        "Investing Services",
        "Premium Investing",
        "Motley Fool",
        "Fool Premium",
        "Palantir",
        "Motley",
        "Trump administration",
        "Key Points",
        "Fool",
        "Trump"
      ],
      "condensed_text": "Title: Where Will Palantir Stock Be in 3 Years?\n\nKey information: Management only expects revenue to grow 31% year over year (to between $3.7 billion and $3.8 billion) in 2025, which isn't exciting for a stock trading for 79 times sales and 172 timesprojected future earnings. More recently, it was awarded a $480 billion deal to help build the army's Maven Smart System -- a data analytics contract thatAlphabet'sGoogle famously abandoned amid employee backlash in 2018. While the Trump administration initially claimed it wanted to reduce the Pentagon's budget, it has radically changed course, with Trump promising a record $1 trillion in defense spending for 2026, a 12% increase from current levels. Suzanne Frey, an executive at Alphabet, is a member of The Motley Fool’s board of directors.Will Ebiefunghas no position in any of the stocks mentioned. Become a Motley Fool member today toget instant access to our top analyst recommendations, in-depth research, investing resources,and more.Learn More Key Points With shares up 647% since 2022,Palantir Technologies(PLTR-3.10%)has performed spectacularly over the last three years, highlighting the potentially life-changing power of tech investing. Since its founding in 2003, Palantir has emerged as a leader in big data analytics, enabling organizations to uncover actionable insights, detect fraud, and optimize their operations by sifting through vast volumes of information. However, Palantir's most significant breakthrough may have come in April, when NATO (a military alliance of 32 countries in Europe and North America) finalized a deal to utilize the company's Maven Smart System to recommend and prioritize targets during combat operations. That said, a good business isn't always a good investment when valuation is taken into consideration. For context, theS&P 500index trades for just 20 times forward earnings, so to call Palantir priced for perfection seems like an understatement. The Motley Fool recommends the following options: long January 2026 $395 calls on Microsoft and short January 2026 $405 calls on Microsoft.\n\nNamed entities:\n- ORG: The Motley Fool's Premium Investing Services, AI, Trump, Immigration and Customs Enforcement (ICE, Maven Smart System\n- DATE: today, the last three years, the next three years, 2003, 2018\n- PERCENT: 647%, 12%, 31%\n- PERSON: Palantir, Peter Thiel, Trump, Dan Ives, Suzanne Frey\n- GPE: OpenAI, U.S., Ukraine, Israel, Palantir\n- MONEY: $480 billion, a record $1 trillion, between $3.7 billion and $3.8 billion, 395, 405\nKeywords: Investing Services, Premium Investing, Motley Fool, Fool Premium, Palantir, Motley, Trump administration, Key Points, Fool, Trump\n",
      "summary": "Based on the processed news information, here are the key factors that could influence MSFT (Microsoft) stock price:\n\n1. **Valuation**: The article highlights that Palantir's stock is trading at 79 times sales and 172 times projected future earnings, which is relatively high compared to the S&P 500 index trading at 20 times forward earnings. This could lead to a decline in MSFT stock price if investors become concerned about the high valuation of Palantir.\n2. **Revenue growth expectations**: Palantir's management expects revenue growth of only 31% year over year in 2025, which may not be exciting for investors who are accustomed to higher growth rates. This could lead to a decline in MSFT stock price if investors become disappointed with the growth prospects of Palantir.\n3. **Competition**: The article mentions that Palantir is a leader in big data analytics, but it does not provide information on the competitive landscape. If there are other companies that offer similar services and have lower valuations, it could lead to a decline in MSFT stock price.\n4. **Trump administration's defense spending**: The article mentions that the Trump administration has promised a record $1 trillion in defense spending for 2026, which could benefit Palantir as a defense contractor. However, this could also lead to increased competition and scrutiny in the defense sector, which could negatively impact MSFT stock price.\n5. **No direct connection to MSFT**: The article does not provide any direct connection between Palantir's stock performance and MSFT stock price. However, if investors become concerned about the high valuation of Palantir, they may also become cautious about investing in other technology stocks, including MSFT.\n\nIn conclusion, while the article does not provide direct information on MSFT stock price, it highlights several factors that could influence the stock market, including valuation, revenue growth expectations, competition, and government spending. If investors become concerned about the high valuation of Palantir, it could lead to a decline in MSFT stock price."
    }
  ],
  "daily_change_percentage": -2.354669555400756,
  "date_generated": "2025-04-22T12:43:05.405809+00:00"
}